{
  "schema_version": "1.2.1",
  "meta": {
    "code": "600519",
    "name": "贵州茅台",
    "diagnosis_at": "2026-05-15T15:00:00+08:00",
    "data_as_of": "2026-05-15 收盘",
    "quote_mode": "close",
    "price": 1332.95,
    "change_pct": -0.69,
    "title_context": "昨日平静震荡 ➔ 今日跌破前低区间创 60 日新低",
    "benchmark_sector": {
      "name": "白酒Ⅱ",
      "index_code": "BK1277"
    }
  },
  "judgment": {
    "state_primary": "平静无驱动态",
    "state_display": "平静无驱动态向阶段切换临界",
    "state_evolution": "昨日典型平静 ➔ 今日结构破位",
    "risk_tone": "加剧",
    "core_dimensions": ["基本面", "概念 / 产业链"],
    "secondary_dimensions": ["技术面", "资金面", "消息面", "市场环境"],
    "technical_evolution": true
  },
  "narrative": {
    "summary_hook": "当前属平静无驱动态向阶段切换临界（昨日典型平静 ➔ 今日结构破位）。驱动为增速放缓叠加主线虹吸，非单一利空。核心风险加剧：空头结构加深，待确认真切换或假突破。",
    "summary_hook_display": "当前属平静无驱动态向阶段切换临界（昨日典型平静 ➔ 今日结构破位）。驱动为增速放缓叠加主线虹吸，非单一利空。",
    "client_brief": "观察 2–3 日：快速收复前低且量能萎缩偏假突破；跌破动能锚点且放量偏切换向下。白酒同业同步走弱则偏板块共性。",
    "dimensions": {
      "基本面": {
        "role": "core",
        "conclusion": "稳态放缓，未见恶化。",
        "data_bullets": [
          "Q1 营收 +6.34%、净利 +1.47%；毛利率约 90%",
          "市盈率处近五年历史中位偏低"
        ],
        "interpretation": "增速回归个位数，护城河在，缺向上催化。"
      },
      "技术面": {
        "role": "secondary_technical",
        "conclusion": "空头结构加深，跌破前低区间。",
        "data_bullets": [
          "趋势转弱，跌破 60 日新低动能",
          "量能温和放大，非放量杀跌"
        ],
        "interpretation": "温和阴跌击穿压制，待 2–3 日确认。"
      },
      "资金面": {
        "role": "secondary",
        "conclusion": "非当前主导。",
        "data_bullets": [],
        "interpretation": "不作交易参考。",
        "html_expanded": {
          "conclusion": "北向与主力流向非当前定价主因，但需关注板块资金虹吸。",
          "data_bullets": [
            "个股资金流分日接口不稳，分日主力净流暂缺",
            "白酒板块整体资金偏好弱于 AI/机器人主线",
            "同业龙头同日普遍走弱，偏板块层面流出"
          ],
          "interpretation": "结构破位阶段资金更看板块共振与主线虹吸，单一北向数据不足以解释今日动能。"
        }
      },
      "消息面": {
        "role": "secondary",
        "conclusion": "非当前主导。",
        "data_bullets": [],
        "interpretation": "不作交易参考。",
        "html_expanded": {
          "conclusion": "无新增重大公司层面催化，定价由结构与板块主导。",
          "data_bullets": [
            "近期无超预期业绩或政策专项利好",
            "行业出清叙事仍占主导，旺季预期尚未兑现",
            "媒体焦点在消费复苏节奏而非单点事件"
          ],
          "interpretation": "缺少正向消息面对冲结构破位；若后续出现板块级政策或旺季数据才可能改变叙事。"
        }
      },
      "概念 / 产业链": {
        "role": "core",
        "conclusion": "白酒板块仍处出清探底期。",
        "data_bullets": [
          "行业判断 2026 H1 延续探底（据公开报道）",
          "5/14 板块曾短暂领涨，5/15 重回弱势"
        ],
        "interpretation": "拐点未到，关注同业同步走弱。"
      },
      "市场环境": {
        "role": "secondary",
        "conclusion": "非当前主导。",
        "data_bullets": [],
        "interpretation": "不作交易参考。",
        "html_expanded": {
          "conclusion": "大盘高位震荡下消费蓝筹承压，主线资金外溢明显。",
          "data_bullets": [
            "指数仍处阶段高位，但内部高低切换加快",
            "AI 算力与机器人板块吸金，消费风格相对落后",
            "同日防御与成长风格分化，白酒非当日主线"
          ],
          "interpretation": "宏观流动性未收紧但风格偏好不利；若主线退潮消费或获短暂修复窗口，需观察 1–2 周。"
        }
      }
    }
  },
  "judgments_j": {
    "j1": "平静无驱动，虹吸与稳态消化，详见上方【基本面】【概念 / 产业链】。",
    "j2": "中期窄幅震荡 1–3 月，等旺季催化。",
    "j3": "共识充分期叠加切换观察",
    "j3_consensus": "共识深化",
    "j4": "对白酒板块强跟随，对大盘偏弱。",
    "j5": "结构破位若确认将延长探底，定价与预期背离风险加剧。"
  },
  "judgments_j_expanded": {
    "j1": {
      "headline": "平静无驱动 + 主线虹吸",
      "conclusion": "稳态基本面消化 + 白酒板块出清期 + AI/机器人主线虹吸。详见上方【基本面】【概念 / 产业链】。",
      "counter_examples": [
        "事件驱动不成立（无新增公司层面催化）",
        "资金面驱动不成立（北向/主力非定价主因）"
      ]
    },
    "j2": {
      "headline": "中期窄幅震荡 1–3 月",
      "conclusion": "缺向上催化，等待旺季或板块级政策窗口。",
      "key_rhythm": "观察 2–3 日结构确认；中期看端午/中秋旺季数据与板块共振。"
    },
    "j3": {
      "headline": "共识充分 + 切换观察",
      "conclusion": "板块出清叙事已充分定价，今日结构破位打开切换观察。",
      "footnote": "四阶段口径：共识充分 → 共识衰退（共识深化 — 与昨日相比）"
    },
    "j4": {
      "headline": "强跟随白酒，弱于大盘",
      "conclusion": "与白酒板块同步走弱；相对 AI 主线明显承压。",
      "footnote": "精确 β 接口不稳，用板块同业同步走弱替代"
    },
    "j5": {
      "risks": [
        { "category": "估值风险", "level": "中", "text": "PE 处历史中位偏低，但增速放缓限制重估" },
        { "category": "主线切换风险", "level": "高", "text": "结构破位若确认，或延长板块探底" },
        { "category": "商誉应收风险", "level": "低", "text": "未发现重大商誉风险" },
        { "category": "股东减持解禁", "level": "低", "text": "暂未取到近 6 个月大额解禁" },
        { "category": "流动性风险", "level": "低", "text": "成交仍属蓝筹正常区间" },
        { "category": "合规风险", "level": "未发现", "text": "未发现 ST/退市信号" },
        { "category": "政策反转风险", "level": "低", "text": "消费政策整体偏中性" },
        { "category": "个股专属风险", "level": "中", "text": "定价与业绩预期仍存背离，需防价值陷阱" }
      ]
    }
  },
  "provenance": {
    "data_notes": "本诊断基于 2026-05-15 收盘数据（akshare 技术枚举，无 OHLC 序列）；北向、概念归属接口不稳；板块判断来自公开报道。",
    "fetch_errors": ["info_error"],
    "disclaimer": "以上分析基于公开数据，仅供投顾内部参考，不构成投资建议；本文不涉及具体买卖点位与目标价；最终投资决策需结合客户风险承受能力与投顾独立判断。"
  }
}
