{
  "schema_version": "1.2.1",
  "meta": {
    "code": "300308",
    "name": "中际旭创",
    "diagnosis_at": "2026-05-15T13:23:00+08:00",
    "data_as_of": "2026-05-15 13:23",
    "quote_mode": "intraday",
    "price": 1052.88,
    "change_pct": -2.33,
    "title_context": "昨日创阶段新高 ➔ 今日高位首日调整"
  },
  "judgment": {
    "state_primary": "活跃热点态",
    "state_display": "活跃热点态叠加高位调整观察期",
    "state_evolution": "昨日强势新高 ➔ 今日高开低走",
    "risk_tone": "加剧",
    "core_dimensions": ["消息面", "概念 / 产业链"],
    "secondary_dimensions": ["基本面", "技术面", "资金面", "市场环境"],
    "technical_evolution": false
  },
  "narrative": {
    "summary_hook": "当前属活跃热点态叠加高位调整观察期（昨日强势新高 ➔ 今日高开低走）。盘中转弱主因资金高低切换，光模块向机器人分流。核心风险加剧：共识接近充分，主线切换信号初现。",
    "summary_hook_display": "当前属活跃热点态叠加高位调整观察期（昨日强势新高 ➔ 今日高开低走）。盘中转弱主因资金高低切换，光模块向机器人分流。",
    "client_brief": "短期情绪窗口约 1–2 周。观察同业是否同步反弹、机器人是否持续分流光模块：板块企稳个股仍弱则切换压力加大，同业共振反弹则偏一日修复。",
    "dimensions": {
      "基本面": {
        "role": "secondary",
        "conclusion": "非当前主导。",
        "data_bullets": [],
        "interpretation": "不作交易参考。",
        "html_expanded": {
          "conclusion": "业绩高增已落地，短期定价不由基本面边际变化驱动。",
          "data_bullets": [
            "Q1 业绩增速仍处高位（据公开披露）",
            "1.6T 量产与算力需求叙事仍有效",
            "估值已反映多数乐观预期，边际催化有限"
          ],
          "interpretation": "基本面提供中期锚但非今日调整主因；切换阶段更看情绪与板块资金分配。"
        }
      },
      "技术面": {
        "role": "secondary",
        "conclusion": "非当前主导。",
        "data_bullets": [],
        "interpretation": "不作交易参考。",
        "html_expanded": {
          "conclusion": "高位首日调整，趋势仍强但短期动能收敛。",
          "data_bullets": [
            "昨日创阶段新高后今日高开低走",
            "中长期趋势仍偏强，短期缓冲较薄",
            "跌破短期动能锚点将构成第一个减弱信号"
          ],
          "interpretation": "属热点股正常高位震荡而非趋势反转；需 1–2 周观察板块是否共振修复。"
        }
      },
      "资金面": {
        "role": "secondary",
        "conclusion": "非当前主导。",
        "data_bullets": [],
        "interpretation": "不作交易参考。",
        "html_expanded": {
          "conclusion": "分日主力明细暂缺，板块层面可见高低切换。",
          "data_bullets": [
            "个股资金流分日接口不稳，主力净流暂缺",
            "光模块同业同日普遍回调",
            "机器人情绪股走强，资金分流信号明确"
          ],
          "interpretation": "调整偏板块资金再分配；若机器人线持续吸金，光模块修复窗口可能缩短。"
        }
      },
      "消息面": {
        "role": "core",
        "conclusion": "前期催化仍有效，今日无新增利好。",
        "data_bullets": [
          "Q1 业绩高增已落地；算力与 CPO 政策仍有效（据公开报道）",
          "下一窗口：5 月底–6 月光通信展会"
        ],
        "interpretation": "催化已充分反映，短期靠情绪与切换。"
      },
      "概念 / 产业链": {
        "role": "core",
        "conclusion": "CPO 板块同步回调，高低切换初现。",
        "data_bullets": [
          "通信板块年内涨幅突出，今日同业普跌",
          "机器人情绪股同日走强，资金分流明显"
        ],
        "interpretation": "调整偏板块层面，切换需 1–2 周确认。"
      },
      "市场环境": {
        "role": "secondary",
        "conclusion": "非当前主导。",
        "data_bullets": [],
        "interpretation": "不作交易参考。",
        "html_expanded": {
          "conclusion": "大盘高位下风格轮动加速，算力主线面临分流考验。",
          "data_bullets": [
            "指数仍处阶段高位，内部结构分化",
            "机器人与算力同日走势背离",
            "成长内部高低切换初现，非全面退潮"
          ],
          "interpretation": "环境仍偏多但主线不唯一；切换是否成立需看 1–2 周板块相对强弱。"
        }
      }
    }
  },
  "judgments_j": {
    "j1": "业绩政策为主轴，今日波动来自切换，详见上方【消息面】【概念 / 产业链】。",
    "j2": "基本面看 1–3 月，短期情绪 1–2 周。",
    "j3": "共识扩散末段近充分",
    "j3_consensus": "共识深化",
    "j4": "强跟随板块，独立超额收敛。",
    "j5": "估值偏紧，主线切换与情绪退潮风险加剧。"
  },
  "judgments_j_expanded": {
    "j1": {
      "headline": "业绩政策主轴 + 切换波动",
      "conclusion": "Q1 高增与算力政策仍有效，今日调整来自高低切换而非基本面恶化。详见上方【消息面】【概念 / 产业链】。",
      "counter_examples": [
        "纯事件驱动不成立（无新增单日利好）",
        "资金面明细暂缺，非独立资金推动"
      ]
    },
    "j2": {
      "headline": "短期 1–2 周，中期 1–3 月",
      "conclusion": "短期看情绪与切换，中期仍看算力需求兑现。",
      "key_rhythm": "5 月底–6 月光通信展会为下一观察窗口；切换是否成立需 1–2 周板块相对强弱。"
    },
    "j3": {
      "headline": "共识扩散末段近充分",
      "conclusion": "热点共识接近充分，高位首日调整打开切换观察。",
      "footnote": "四阶段口径：共识扩散 → 共识充分（共识深化 — 与昨日相比）"
    },
    "j4": {
      "headline": "强跟随板块，超额收敛",
      "conclusion": "与 CPO 板块同步回调；相对机器人线超额收敛。",
      "footnote": "精确相关系数接口不稳，用同业普跌与分流信号替代"
    },
    "j5": {
      "risks": [
        { "category": "估值风险", "level": "高", "text": "乐观预期已充分反映，边际催化有限" },
        { "category": "主线切换风险", "level": "高", "text": "机器人分流光模块，切换信号初现" },
        { "category": "商誉应收风险", "level": "低", "text": "未发现重大商誉风险" },
        { "category": "股东减持解禁", "level": "中", "text": "高位股需关注减持与解禁日历" },
        { "category": "流动性风险", "level": "中", "text": "高位震荡期承接波动加大" },
        { "category": "合规风险", "level": "未发现", "text": "未发现 ST/退市信号" },
        { "category": "政策反转风险", "level": "低", "text": "算力政策方向仍偏支持" },
        { "category": "个股专属风险", "level": "中", "text": "1.6T 量产节奏若不及预期或放大调整" }
      ]
    }
  },
  "provenance": {
    "data_notes": "本诊断基于 2026-05-15 13:23 盘中数据；个股资金流分日接口不稳；精确概念指数暂缺，已用同业与媒体报道替代。",
    "fetch_errors": ["fund_flow_error"],
    "disclaimer": "以上分析基于公开数据，仅供投顾内部参考，不构成投资建议；本文不涉及具体买卖点位与目标价；最终投资决策需结合客户风险承受能力与投顾独立判断。"
  }
}
