{
  "schema_version": "1.2.1",
  "meta": {
    "code": "300276",
    "name": "三丰智能",
    "diagnosis_at": "2026-05-15T13:23:00+08:00",
    "data_as_of": "2026-05-15 13:23",
    "quote_mode": "intraday",
    "price": 8.42,
    "change_pct": 19.94,
    "title_context": "昨日温和试探 ➔ 今日顶格 20CM 涨停异动"
  },
  "judgment": {
    "state_primary": "个股异动态",
    "state_display": "个股异动态叠加板块共振",
    "state_evolution": "昨日弱势试探 ➔ 今日涨停异动",
    "risk_tone": "加剧",
    "core_dimensions": ["消息面", "资金面"],
    "secondary_dimensions": ["基本面", "技术面", "概念 / 产业链", "市场环境"],
    "technical_evolution": false
  },
  "narrative": {
    "summary_hook": "当前属个股异动态叠加板块共振（昨日弱势试探 ➔ 今日涨停异动）。驱动为机器人催化与资金情绪，非业绩反转。核心风险加剧：题材主导、估值无锚。",
    "summary_hook_display": "当前属个股异动态叠加板块共振（昨日弱势试探 ➔ 今日涨停异动）。驱动为机器人催化与资金情绪，非业绩反转。",
    "client_brief": "弹性窗口约 3–7 个交易日。次日看开盘承接：高开高走情绪延续，高开低走或同板块小盘分化则是兑现信号。勿用长期业绩框架持有。",
    "dimensions": {
      "基本面": {
        "role": "secondary",
        "conclusion": "非当前主导。",
        "data_bullets": [],
        "interpretation": "不作交易参考。",
        "html_expanded": {
          "conclusion": "基本面未改善，本轮属概念表现与业绩背离。",
          "data_bullets": [
            "2026 Q1 营收同比约 -24%，归母净利由盈转亏",
            "扣非净利更弱，毛利率约 11% 低于同行龙头区间",
            "负债率超行业警戒线，订单兑现能力未验证"
          ],
          "interpretation": "资金博弈的是题材预期而非当期业绩；情绪退潮时基本面缺口会放大回撤压力。"
        }
      },
      "技术面": {
        "role": "secondary",
        "conclusion": "非当前主导。",
        "data_bullets": [],
        "interpretation": "不作交易参考。",
        "html_expanded": {
          "conclusion": "单日结构质变，但封板换手偏低待次日确认。",
          "data_bullets": [
            "近 60 日整体仍处弱势，今日低开急封顶格涨停",
            "中长期压制被一次性突破，动能由板块情绪主导",
            "一字封板下真实承接需看次日开盘与板块扩散"
          ],
          "interpretation": "典型题材股启动信号；后续观察能否维持趋势转强结构，而非单日脉冲。"
        }
      },
      "资金面": {
        "role": "core",
        "conclusion": "试探资金集中兑现窗口。",
        "data_bullets": [
          "盘中成交额约 6 亿元，较近 20 日均量放大约 3 倍",
          "一字封板换手偏低，博弈看次日开盘"
        ],
        "interpretation": "情绪亢奋，由板块溢价主导。"
      },
      "消息面": {
        "role": "core",
        "conclusion": "机器人催化叠加。",
        "data_bullets": [
          "Optimus 量产预期与具身智能集采（据公开报道）",
          "5 月以来板块多股涨停，情绪扩散至二线小盘"
        ],
        "interpretation": "利好龙头兑现型标的，本股偏流动性博弈。"
      },
      "概念 / 产业链": {
        "role": "secondary",
        "conclusion": "非当前主导。",
        "data_bullets": [],
        "interpretation": "不作交易参考。",
        "html_expanded": {
          "conclusion": "板块内偏流动性博弈型小盘，订单兑现弱于龙头。",
          "data_bullets": [
            "同业龙头具身订单规模显著领先（据公开报道）",
            "本股 Q1 仍亏损，未体现订单兑现能力",
            "板块情绪扩散时小盘弹性大，回撤亦更剧烈"
          ],
          "interpretation": "催化在板块、兑现不在自身的错位预期需警惕；龙头看订单，小盘看情绪窗口。"
        }
      },
      "市场环境": {
        "role": "secondary",
        "conclusion": "非当前主导。",
        "data_bullets": [],
        "interpretation": "不作交易参考。",
        "html_expanded": {
          "conclusion": "高低切换窗口中机器人线受益，算力主线同日承压。",
          "data_bullets": [
            "CPO 龙头同日回调，光模块板块资金分流",
            "机器人情绪股普涨，切换信号初现",
            "大盘指数仍处高位，风格轮动加快"
          ],
          "interpretation": "切换期小盘弹性大于龙头，但切换结束或情绪退潮时回撤同样更快。"
        }
      }
    }
  },
  "judgments_j": {
    "j1": "机器人催化叠加资金情绪，详见上方【消息面】【资金面】。",
    "j2": "事件情绪驱动，弹性约 3–7 个交易日。",
    "j3": "个股共识刚形成",
    "j3_consensus": "共识深化",
    "j4": "强跟随机器人板块，单日超额显著。",
    "j5": "估值无锚，情绪退潮后回吐压力大。"
  },
  "judgments_j_expanded": {
    "j1": {
      "headline": "概念主线 + 板块情绪驱动",
      "conclusion": "板块共振 + 题材兑现预期 + 前期主力试探性建仓的兑现窗口。详见上方【消息面】【资金面】【概念 / 产业链】。",
      "counter_examples": [
        "基本面驱动不成立（Q1 仍亏损、扣非更差）",
        "技术面驱动不成立（涨停前 60 日仍处弱势）"
      ]
    },
    "j2": {
      "headline": "短期（数日至 2 周）",
      "conclusion": "事件 + 板块情绪驱动，而非业绩兑现，持续性取决于板块情绪窗口。",
      "key_rhythm": "板块情绪窗口约 5–10 个交易日；个股弹性窗口约 3–7 个交易日；后续取决于板块龙头订单数据是否持续兑现。"
    },
    "j3": {
      "headline": "个股共识刚形成、板块扩散中后段",
      "conclusion": "个股侧共识刚形成，板块侧处于共识扩散的中后段。",
      "footnote": "四阶段口径：共识刚形成 → 共识扩散 → 共识充分 → 共识衰退（共识深化 — 与昨日相比）"
    },
    "j4": {
      "headline": "强跟随板块，单日独立超额",
      "conclusion": "今日涨停涨幅超板块平均，板块扩散中的独立超额；与上证指数相关性弱。",
      "footnote": "精确 β / 相关系数接口不稳，本诊断用板块情绪与消息面共振替代"
    },
    "j5": {
      "risks": [
        { "category": "估值风险", "level": "高", "text": "已亏损，PE 无意义" },
        { "category": "主线切换风险", "level": "高", "text": "纯题材驱动，情绪退潮后可能快速回落" },
        { "category": "商誉应收风险", "level": "中", "text": "应收周转偏慢，需关注回款节奏" },
        { "category": "股东减持解禁", "level": "高", "text": "高位常触发减持公告，需查近 6 个月解禁日历" },
        { "category": "流动性风险", "level": "中", "text": "今日放量但板块退潮时可能迅速缩量" },
        { "category": "合规风险", "level": "低", "text": "暂未 ST，但持续亏损需关注" },
        { "category": "政策反转风险", "level": "低", "text": "人形机器人属长期政策方向" },
        { "category": "个股专属风险", "level": "高", "text": "主业下滑 + 缺乏护城河，订单兑现弱于龙头" }
      ]
    }
  },
  "provenance": {
    "data_notes": "本诊断基于 2026-05-15 13:23 盘中数据（腾讯报价 + akshare 技术枚举）；资金面分日明细接口不稳已用成交额替代；概念归属接口阻断，板块信息来自公开报道。",
    "fetch_errors": ["fund_flow_error", "info_error"],
    "disclaimer": "以上分析基于公开数据，仅供投顾内部参考，不构成投资建议；本文不涉及具体买卖点位与目标价；最终投资决策需结合客户风险承受能力与投顾独立判断。"
  }
}
